[
  {
    "id": "apollo",
    "name": "Аполлон",
    "nameOriginal": "Apollo",
    "agency": ["NASA"],
    "type": "crewed",
    "launch": "1968-10-11",
    "arrival": "1969-07-20",
    "end": "1972-12",
    "status": "completed",
    "statusCheckedAt": "2026-10-04",
    "verifiedBy": "agent",
    "summary": "Пилотируемая программа NASA целиком: здесь собраны все полёты «Аполлонов» с людьми, от первого («Аполлон-7», 1968) до последнего («Аполлон-17», 1972). Шесть экспедиций сели на Луну, и по ней прошли 12 астронавтов. Они привезли на Землю 382 кг лунных камней, грунта и пыли.",
    "worldIds": ["moon"],
    "instruments": [
      { "name": "ALSEP", "what": "Набор приборов, оставленный на Луне: сейсмометры, магнитометры, датчики потока тепла" },
      { "name": "Лазерные отражатели", "what": "Зеркала-уголки, по которым с Земли лазером измеряют расстояние до Луны" },
      { "name": "Инструменты для сбора образцов", "what": "Совки, щипцы и трубки для взятия кернов — грунт и камни для лабораторий на Земле" }
    ],
    "discoveries": [
      "Первые люди на другом небесном теле — «Аполлон-11», июль 1969 года",
      "Шесть экспедиций доставили на Землю 382 кг лунного вещества",
      "Лунный грунт и камни до сих пор изучают в лабораториях"
    ],
    "mediaIds": ["apollo_bootprint"],
    "links": [
      { "title": "NASA: The Apollo Program", "url": "https://www.nasa.gov/the-apollo-program/" },
      { "title": "NASA: Lunar Sample Curation", "url": "https://curator.jsc.nasa.gov/lunar/" }
    ]
  },
  {
    "id": "bepicolombo",
    "name": "БепиКоломбо",
    "nameOriginal": "BepiColombo",
    "agency": ["ESA", "JAXA"],
    "type": "orbiter",
    "launch": "2018-10-20",
    "arrival": "2026-11-21",
    "end": null,
    "status": "en_route",
    "statusCheckedAt": "2026-10-04",
    "verifiedBy": "agent",
    "summary": "Совместная миссия Европы и Японии: два орбитальных аппарата летят к Меркурию вместе. Перелётный модуль отделился в сентябре 2026 года, выход на орбиту Меркурия запланирован на 21 ноября 2026 года, а научная работа — с апреля 2027 года.",
    "worldIds": ["mercury"],
    "instruments": [
      { "name": "MERTIS", "what": "Инфракрасный спектрометр и радиометр: температура и минералы поверхности" },
      { "name": "BELA", "what": "Лазерный высотомер: рельеф Меркурия" },
      { "name": "MORE", "what": "Радиоэксперимент: гравитационное поле и внутреннее строение" },
      { "name": "MPO-MAG", "what": "Магнитометр: магнитное поле Меркурия" }
    ],
    "discoveries": [
      "Во время шести пролётов мимо Меркурия сфотографировал планету и изучил её окрестности ещё до выхода на орбиту"
    ],
    "mediaIds": [],
    "links": [
      { "title": "ESA: BepiColombo", "url": "https://www.esa.int/Science_Exploration/Space_Science/BepiColombo" },
      { "title": "ESA: Latest updates — BepiColombo's arrival at Mercury", "url": "https://www.esa.int/Science_Exploration/Space_Science/BepiColombo/Latest_updates_BepiColombo_s_arrival_at_Mercury" }
    ]
  },
  {
    "id": "cassini",
    "name": "Кассини",
    "nameOriginal": "Cassini",
    "agency": ["NASA", "ESA", "ASI"],
    "type": "orbiter",
    "launch": "1997-10-15",
    "arrival": "2004-07-01",
    "end": "2017-09-15",
    "status": "completed",
    "statusCheckedAt": "2026-10-04",
    "verifiedBy": "agent",
    "summary": "Первый аппарат на орбите Сатурна. «Кассини» тринадцать лет изучал планету, кольца и спутники, доставил к Титану зонд «Гюйгенс» и своим радаром заглянул под дымку Титана. В 2017 году его специально направили в атмосферу Сатурна.",
    "worldIds": ["titan"],
    "instruments": [
      { "name": "RADAR", "what": "Радар: видел поверхность Титана сквозь дымку, нашёл моря и озёра" },
      { "name": "ISS", "what": "Камеры: снимки Сатурна, колец и спутников" },
      { "name": "VIMS", "what": "Спектрометр видимого и инфракрасного света: состав поверхности и атмосферы" },
      { "name": "CIRS", "what": "Инфракрасный спектрометр: температура атмосферы и поверхности" },
      { "name": "Radio Science", "what": "Радиоэксперимент: гравитация и просвечивание атмосфер радиосигналом" }
    ],
    "discoveries": [
      "На Титане есть моря и реки из жидкого метана и этана",
      "У спутника Энцелад из-подо льда бьют струи водяного пара"
    ],
    "mediaIds": ["cassini_titan"],
    "links": [
      { "title": "NASA: Cassini", "url": "https://science.nasa.gov/mission/cassini/" },
      { "title": "ESA: Cassini-Huygens", "url": "https://www.esa.int/Science_Exploration/Space_Science/Cassini-Huygens" }
    ]
  },
  {
    "id": "curiosity",
    "name": "Кьюриосити",
    "nameOriginal": "Curiosity",
    "agency": ["NASA"],
    "type": "rover",
    "launch": "2011-11-26",
    "arrival": "2012-08-06",
    "end": null,
    "status": "active",
    "statusCheckedAt": "2026-10-04",
    "verifiedBy": "agent",
    "summary": "Марсоход размером с автомобиль из миссии Mars Science Laboratory. С 2012 года он работает в кратере Гейл и поднимается по склонам горы Шарп, читая слои горных пород как летопись древнего Марса. На нём есть метеостанция, которая каждый день измеряет давление и температуру.",
    "worldIds": ["mars"],
    "instruments": [
      { "name": "Mastcam", "what": "Цветные камеры на мачте: пейзажи, закаты, облака" },
      { "name": "ChemCam", "what": "Лазер испаряет крошку камня, а спектрометр определяет её состав" },
      { "name": "SAM", "what": "Мини-лаборатория: состав атмосферы и грунта, поиск органических молекул" },
      { "name": "REMS", "what": "Метеостанция: давление, температура, ветер и влажность" },
      { "name": "RAD", "what": "Датчик радиации на поверхности Марса" }
    ],
    "discoveries": [
      "В кратере Гейл когда-то было озеро, в котором могли бы жить микробы",
      "В марсианских породах найдены органические молекулы",
      "Сфотографировал голубоватый закат на Марсе"
    ],
    "mediaIds": ["curiosity_gale"],
    "links": [{ "title": "NASA: Curiosity", "url": "https://science.nasa.gov/mission/msl-curiosity/" }]
  },
  {
    "id": "europa_clipper",
    "name": "Европа Клиппер",
    "nameOriginal": "Europa Clipper",
    "agency": ["NASA"],
    "type": "orbiter",
    "launch": "2024-10-14",
    "arrival": "2030-04",
    "end": null,
    "status": "en_route",
    "statusCheckedAt": "2026-10-04",
    "verifiedBy": "agent",
    "summary": "Самый большой межпланетный аппарат NASA летит к Юпитеру, чтобы изучить его спутник Европу. Прибытие ожидается в апреле 2030 года: аппарат выйдет на орбиту вокруг Юпитера и много раз пролетит близко к Европе. Главный вопрос — есть ли под ледяной корой условия, пригодные для жизни.",
    "worldIds": ["europa", "jupiter"],
    "instruments": [
      { "name": "REASON", "what": "Радар: просвечивает ледяную кору и ищет воду внутри неё" },
      { "name": "ECM", "what": "Магнитометр: проверит, есть ли под льдом солёный океан" },
      { "name": "E-THEMIS", "what": "Тепловая камера: ищет тёплые участки на поверхности" },
      { "name": "MISE", "what": "Инфракрасный спектрометр: состав льда и солей" },
      { "name": "EIS", "what": "Камеры: подробная карта поверхности Европы" }
    ],
    "discoveries": [],
    "mediaIds": ["europa_clipper_spacecraft"],
    "links": [{ "title": "NASA: Europa Clipper", "url": "https://science.nasa.gov/mission/europa-clipper/" }]
  },
  {
    "id": "galileo",
    "name": "Галилео",
    "nameOriginal": "Galileo",
    "agency": ["NASA"],
    "type": "orbiter",
    "launch": "1989-10-18",
    "arrival": "1995-12-07",
    "end": "2003-09-21",
    "status": "completed",
    "statusCheckedAt": "2026-10-04",
    "verifiedBy": "agent",
    "summary": "Первый аппарат на орбите Юпитера. В день прибытия, 7 декабря 1995 года, его спускаемый зонд вошёл в атмосферу Юпитера и передавал данные около часа, пока не замолчал от жары и давления. Восемь лет «Галилео» изучал Юпитер и его спутники, а в 2003 году его направили в атмосферу планеты.",
    "worldIds": ["jupiter", "europa"],
    "instruments": [
      { "name": "Атмосферный зонд", "what": "Спускался на парашюте в атмосферу Юпитера: температура, давление, состав газа" },
      { "name": "MAG", "what": "Магнитометр: заметил, как Европа «отвечает» на магнитное поле Юпитера" },
      { "name": "SSI", "what": "Камера: снимки Юпитера и его спутников" },
      { "name": "NIMS", "what": "Инфракрасный спектрометр: состав облаков и поверхностей спутников" }
    ],
    "discoveries": [
      "Первое прямое измерение атмосферы Юпитера изнутри — зонд в 1995 году",
      "Магнитные данные указывают на солёный слой воды под льдом Европы, Ганимеда и Каллисто"
    ],
    "mediaIds": ["galileo_europa"],
    "links": [{ "title": "NASA: Galileo", "url": "https://science.nasa.gov/mission/galileo/" }]
  },
  {
    "id": "grace",
    "name": "GRACE и GRACE-FO",
    "nameOriginal": "GRACE / GRACE Follow-On (Gravity Recovery and Climate Experiment)",
    "agency": ["NASA", "DLR", "GFZ"],
    "type": "orbiter",
    "launch": "2002-03-17",
    "arrival": null,
    "end": null,
    "status": "active",
    "statusCheckedAt": "2026-10-04",
    "verifiedBy": "agent",
    "summary": "Эта карточка объединяет две миссии: GRACE (летала с 2002 по 2017 год) и её продолжение GRACE-FO (запущена 22 мая 2018 года и работает сейчас). В обеих два одинаковых спутника летят друг за другом и очень точно измеряют расстояние между собой. Оно меняется, когда под ними сильнее или слабее притяжение, — так строят карту гравитации Земли.",
    "worldIds": ["earth"],
    "instruments": [
      { "name": "KBR", "what": "Микроволновая связь между спутниками: расстояние между ними с огромной точностью" },
      { "name": "LRI", "what": "Лазерный дальномер на GRACE-FO: ещё более точное измерение расстояния" },
      { "name": "Акселерометры", "what": "Отделяют гравитацию от торможения о воздух и давления солнечного света" }
    ],
    "discoveries": [
      "Следят, как тают ледники Гренландии и Антарктиды",
      "Показывают, где на Земле убывают подземные воды"
    ],